[
  {
    "id": "caruncho",
    "name": "Caruncho",
    "level": 1,
    "description": "O demônio mais comum da região de Hominum no Éter. Semelhante a um grande besouro voador, usado como batedor por muitos invocadores.",
    "rarity": "common",
    "temperament_base": "cautious",
    "temperament_variants": ["cautious", "territorial", "social"],
    "base_stats": { "hp": 20, "mana": 5, "strength": 3, "agility": 6, "armor": 2 },
    "abilities": [
      { "id": "mandible_bite",    "name": "Mordida de Mandíbulas", "type": "active",  "effect_type": "damage_physical", "description": "Ataque básico com as poderosas mandíbulas do Caruncho." },
      { "id": "paralysis_sting",  "name": "Ferrão Paralisante",    "type": "active",  "effect_type": "paralysis",       "description": "Ferrão cruel que paralisa temporariamente o inimigo." },
      { "id": "scout_advance",    "name": "Batedor",               "type": "passive", "effect_type": "scout",           "description": "Explora o Éter antes de demônios mais poderosos, detectando perigos." }
    ],
    "habitat": ["hominum_ether_region"],
    "capture_difficulty": "easy",
    "known_summoners": ["Rory (Malaqui)", "Genevieve (Azura)", "Lovett (Valens)"],
    "lore": "Os Carunchos são os demônios mais comuns na região de Hominum do Éter e também fonte de alimento de várias espécies demoníacas. Os Carunchos Escaravelhos são os mais poderosos do gênero — grandes besouros voadores que variam do castanho fosco ao colorido brilhante. Muitos invocadores os usam como batedores para explorar o Éter."
  },
  {
    "id": "pyrausta",
    "name": "Pyrausta",
    "level": 2,
    "description": "Demônio tão raro que não havia registros de captura até hoje. Forma de lagarto alado com partes de inseto e antenas multifuncionais.",
    "rarity": "very_rare",
    "temperament_base": "cautious",
    "temperament_variants": ["cautious", "solitary"],
    "base_stats": { "hp": 35, "mana": 15, "strength": 5, "agility": 12, "armor": 3 },
    "abilities": [
      { "id": "heat_sense",         "name": "Sensor de Calor",       "type": "passive", "effect_type": "scout",           "description": "Antenas funcionam como sensor de calor, captando variações térmicas do ambiente." },
      { "id": "vibration_detect",   "name": "Detecção de Vibração",  "type": "passive", "effect_type": "scout",           "description": "Detecta vibrações no ar e umidade, antecipando movimentos." },
      { "id": "winged_tail_slash",  "name": "Golpe Alado",           "type": "active",  "effect_type": "damage_physical", "description": "Ataque veloz com as asas e cauda em forma de lagarto." }
    ],
    "habitat": ["hominum_ether_region", "volcanic_zones"],
    "capture_difficulty": "legendary",
    "known_summoners": ["Otelo Thorsager"],
    "lore": "Pyraustas são tão raros que, até sua primeira captura, não havia registros de sua existência. Sua forma de lagarto alado parece ser composta pelas partes de um inseto. As antenas multifuncionais funcionam como sensor de calor, captam a vibração do ar e detectam umidade — tornando-os impossíveis de surpreender."
  },
  {
    "id": "donzela",
    "name": "Donzela",
    "level": 3,
    "description": "Demônio-inseto semelhante a uma libélula gigante com carapaça iridescente. Extremamente veloz no ar e parente dos Carunchos.",
    "rarity": "uncommon",
    "temperament_base": "territorial",
    "temperament_variants": ["territorial", "aggressive", "cautious"],
    "base_stats": { "hp": 55, "mana": 10, "strength": 8, "agility": 20, "armor": 4 },
    "abilities": [
      { "id": "aerial_dash",       "name": "Investida Aérea",       "type": "active",  "effect_type": "damage_physical", "description": "Ataque em alta velocidade, mudando de direção num piscar de olhos." },
      { "id": "triple_sting",      "name": "Ferrão Triplo",         "type": "active",  "effect_type": "paralysis",       "description": "Ferrão até 3 vezes mais letal que o do Caruncho, paralisa por mais tempo." }
    ],
    "habitat": ["hominum_ether_region"],
    "capture_difficulty": "moderate",
    "known_summoners": ["Verity Faversham"],
    "lore": "Um demônio-inseto — uma libélula gigante com carapaça iridescente e asas. Essas criaturas são velozes no ar, mudando de direção num piscar de olhos. Parentes dos Carunchos, têm ferrões até 3 vezes mais letais e são comuns no Éter."
  },
  {
    "id": "kamaitachi",
    "name": "Kamaitachi",
    "level": 3,
    "description": "Demônio similar a uma doninha, com placas ósseas serrilhadas no lugar das patas. Comum nos domínios órquicos do Éter.",
    "rarity": "uncommon",
    "temperament_base": "aggressive",
    "temperament_variants": ["aggressive", "territorial"],
    "base_stats": { "hp": 60, "mana": 8, "strength": 12, "agility": 16, "armor": 6 },
    "abilities": [
      { "id": "serrated_slash",   "name": "Corte Serrilhado",   "type": "active",  "effect_type": "damage_physical", "description": "Placas ósseas serrilhadas nas patas causam ferimentos profundos." },
      { "id": "frontal_charge",   "name": "Carga Frontal",      "type": "active",  "effect_type": "damage_physical", "description": "Lança-se contra o inimigo com velocidade de doninha, mirando linhas de frente." }
    ],
    "habitat": ["orc_ether_region"],
    "capture_difficulty": "hard",
    "known_summoners": [],
    "lore": "Demônio similar a uma doninha, com placas ósseas serrilhadas no lugar das patas. Comum nos domínios órquicos do Éter, sempre atacam as linhas de frente de Hominum."
  },
  {
    "id": "vespe",
    "name": "Vespe",
    "level": 4,
    "description": "Semelhante a uma vespa gigante. Voa em enxames e possui ferrão tão potente quanto o da Donzela. Favorito dos xamãs orcs.",
    "rarity": "uncommon",
    "temperament_base": "territorial",
    "temperament_variants": ["territorial", "aggressive", "social"],
    "base_stats": { "hp": 70, "mana": 15, "strength": 10, "agility": 18, "armor": 5 },
    "abilities": [
      { "id": "venom_sting",      "name": "Ferrão Venenoso",    "type": "active",   "effect_type": "damage_venom",    "description": "Ferrão potente que injeta veneno paralisante." },
      { "id": "mandible_crush",   "name": "Esmagamento de Mandíbulas", "type": "active", "effect_type": "damage_physical", "description": "Fortes mandíbulas causam dano devastador em alvos presos." },
      { "id": "swarm_assault",    "name": "Ataque em Enxame",   "type": "reaction", "effect_type": "swarm",           "description": "Vespes convocam seus pares quando ameaçados, tornando a captura extremamente difícil." }
    ],
    "habitat": ["orc_ether_region", "hominum_ether_region"],
    "capture_difficulty": "hard",
    "known_summoners": [],
    "lore": "Parecidos com uma vespa gigante, são difíceis de capturar porque voam em enxames. Dotados de um ferrão tão potente quanto o da Donzela e fortes mandíbulas, são um dos favoritos dos xamãs orcs."
  },
  {
    "id": "estirge",
    "name": "Estirge",
    "level": 4,
    "description": "Parece com uma coruja de penas vermelhas e quatro garras. Extremamente agressivo — mata e come seus irmãos ao atingir a maturidade.",
    "rarity": "uncommon",
    "temperament_base": "aggressive",
    "temperament_variants": ["aggressive", "cruel"],
    "base_stats": { "hp": 75, "mana": 12, "strength": 14, "agility": 16, "armor": 4 },
    "abilities": [
      { "id": "four_claw_rake",      "name": "Rasgo das Quatro Garras", "type": "active",   "effect_type": "damage_physical", "description": "Ataque simultâneo com as quatro garras, causando múltiplas lacerações." },
      { "id": "cannibal_frenzy",     "name": "Frenesi Canibal",         "type": "reaction", "effect_type": "damage_physical", "description": "Quando ameaçado, entra em frenesi, aumentando o dano mas ignorando aliados." }
    ],
    "habitat": ["hominum_ether_region"],
    "capture_difficulty": "hard",
    "known_summoners": ["Inquisidor Damian Rook"],
    "lore": "Bastante confundido com a Griforuja, o Estirge se parece com corujas, mas tem quatro garras. As penas são vermelhas, dando a ele uma aparência amedrontadora. Raramente são capturados por conta de sua natureza agressiva — Estirges matam e comem seus irmãos quando atingem a maturidade."
  },
  {
    "id": "griforuja",
    "name": "Griforuja",
    "level": 4,
    "description": "Combinação de gato e coruja. Inteligente e ágil, cria laços fortes com seu invocador. Solitário por natureza.",
    "rarity": "rare",
    "temperament_base": "loyal",
    "temperament_variants": ["loyal", "solitary", "protective"],
    "base_stats": { "hp": 80, "mana": 20, "strength": 16, "agility": 22, "armor": 7 },
    "abilities": [
      { "id": "beak_strike",   "name": "Bico Afiado",      "type": "active", "effect_type": "damage_physical", "description": "Bico poderoso desfere golpes precisos de alta penetração." },
      { "id": "claw_grasp",    "name": "Garras Prensoras", "type": "active", "effect_type": "damage_physical", "description": "Garras prendem o inimigo, reduzindo sua agilidade temporariamente." }
    ],
    "habitat": ["hominum_ether_region"],
    "capture_difficulty": "moderate",
    "known_summoners": ["Fletcher Raleigh"],
    "lore": "É uma combinação de gato e coruja, próxima dos Grifos e dos Chamrosh, porém mais raro. O bico e as garras são sua maior arma, mas é a inteligência e agilidade que fazem dele um demônio tão desejado. Solitário por natureza, cria laços fortes com seu invocador e demônios companheiros."
  },
  {
    "id": "lutra",
    "name": "Lutra",
    "level": 4,
    "description": "Semelhante a uma lontra supercrescida com cauda espinhosa como maça-estrela e enormes dentes incisivos. Gosta de nadar em lagos e rios do Éter.",
    "rarity": "uncommon",
    "temperament_base": "territorial",
    "temperament_variants": ["territorial", "protective", "aggressive"],
    "base_stats": { "hp": 85, "mana": 10, "strength": 18, "agility": 14, "armor": 8 },
    "abilities": [